Page,Location,Tour,Streetview Embed Code,Source,Context,Preview,Quote
,,City on Fire,,,,,
196-197,3rd Ave & E 53rd St,Learning to Read New York,"<iframe src=""https://www.google.com/maps/embed?pb=!1m0!3m2!1sen!2sus!4v1446474224371!6m8!1m7!1sx-DtoqqZEPes0BP6X1I3Bw!2m2!1d40.75772724542881!2d-73.96936051734659!3f208!4f0!5f0.7820865974627469"" width=""600"" height=""450"" frameborder=""0"" style=""border:0"" allowfullscreen></iframe>","<i>City Poet: The Life and Times of Frank O’Hara</i> by Brad Gooch, 1993","O’Hara, new to Manhattan, recalls cruising advice from his old roommate, Eliot House","He said, “There’s a special train. After you’ve done the Third Avenue bars, you take it at Fifty-third and Third and it goes right to West Eighth Street. And then you have all of Eighth Street.” 
",
197,3rd Ave & E 53rd St,Learning to Read New York,"<iframe src=""https://www.google.com/maps/embed?pb=!1m0!3m2!1sen!2sus!4v1446475153627!6m8!1m7!1sd_FuGZkoZ9BoegfJBFyD7w!2m2!1d40.75794822801047!2d-73.96920265242464!3f128!4f0!5f0.7820865974627469"" width=""600"" height=""450"" frameborder=""0"" style=""border:0"" allowfullscreen></iframe>","<i>Please Kill Me: The Uncensored Oral History of Punk</i> by Legs McNeil and Gillian McCain, 1996","Legs McNeil quoting himself in his iconic oral history of American punk, <i>Please Kill Me.</i>","The Ramones’ “53rd & 3rd,” is a chilling song. It’s about this guy standing on the corner of Fifty-third and Third trying to hustle guys, but nobody ever picks him. Then when somebody does, he kills the john to prove that he’s not a sissy. ","The Ramones’ “53rd & 3rd,” is a chilling song. It’s about this guy standing on the corner of Fifty-third and Third trying to hustle guys, but nobody ever picks him. Then when somebody does, he kills the john to prove that he’s not a sissy. <br>                                                                                                                                                                                    <br>If you think you can, well come on man/ I was a Green Beret in Viet Nam/ No more of your fairy stories/ ’Cause I got my other worries 
— The Ramones, “53rd and 3rd”"
197,3rd Ave & E 53rd St,Learning to Read New York,"<iframe src=""https://www.google.com/maps/embed?pb=!1m0!3m2!1sen!2sus!4v1446475870520!6m8!1m7!1sGmAv3NyOOORueb_QtDe9BQ!2m2!1d40.75738743036494!2d-73.96864963816111!3f203!4f0!5f0.7820865974627469"" width=""600"" height=""450"" frameborder=""0"" style=""border:0"" allowfullscreen></iframe>","<i>Please Kill Me: The Uncensored Oral History of Punk</i>by Legs McNeil and Gillian McCain, 1996","Mickey Leigh, brother of Joey Ramone, describing his youth as a “hustler.” ","I remember driving by Fifty-third Street and Third Avenue and seeing Dee Dee Ramone standing out there. He had a black leather motorcycle jacket on, the one he would later wear on the first album cover. ","I remember driving by Fifty-third Street and Third Avenue and seeing Dee Dee Ramone standing out there. He had a black leather motorcycle jacket on, the one he would later wear on the first album cover. He was just standing there, so I knew what he was doing, because I knew that was the gay-boy hustler spot. Still, I was kind of shocked to see somebody I knew standing there, like, “Holy shit. That’s Doug standing there. He’s really doing it.” "
197,E 52nd St between 3rd and 2nd Aves,Learning to Read New York,"<iframe src=""https://www.google.com/maps/embed?pb=!1m0!3m2!1sen!2sus!4v1446475415437!6m8!1m7!1sCRz9gs5-ZPDNXbtlpGjmQA!2m2!1d40.75652234261718!2d-73.96853910084147!3f44!4f0!5f0.7820865974627469"" width=""600"" height=""450"" frameborder=""0"" style=""border:0"" allowfullscreen></iframe>","""September 1, 1939"" by W.H. Auden ","Auden wrote this poem in the first days of World War II in a New York City gay bar. E. M. Forster, in awe of ""September 1, 1939"" upon publication writes, ""Because he once wrote 'We must love one another or die' he can command me to follow him.""  ","I sit in one of the dives<br>
On Fifty-second Street<br>
Uncertain and afraid<br>
","I sit in one of the dives<br>
On Fifty-second Street<br>
Uncertain and afraid<br>
<br><br>
As the clever hopes expire<br>
Of a low dishonest decade:<br>
Waves of anger and fear<br>
Circulate over the bright <br>
And darkened lands of the earth,<br>
Obsessing our private lives;<br>
The unmentionable odour of death<br>
Offends the September night.<br>
<br><br>
Accurate scholarship can <br>
Unearth the whole offence<br>
From Luther until now<br>
That has driven a culture mad,<br>
Find what occurred at Linz,<br>
What huge imago made<br>
A psychopathic god:<br>
I and the public know<br>
What all schoolchildren learn,<br>
Those to whom evil is done<br>
Do evil in return. <br>
<br><br>
Exiled Thucydides knew<br>
All that a speech can say<br>
About Democracy,<br>
And what dictators do,<br>
The elderly rubbish they talk<br>
To an apathetic grave;<br>
Analysed all in his book,<br>
The enlightenment driven away,<br>
The habit-forming pain,<br>
Mismanagement and grief:<br>
We must suffer them all again.<br>
<br><br>
Into this neutral air<br>
Where blind skyscrapers use<br>
Their full height to proclaim<br>
The strength of Collective Man,<br>
Each language pours its vain<br>
Competitive excuse:<br>
But who can live for long<br>
In an euphoric dream;<br>
Out of the mirror they stare,<br>
Imperialism’s face<br>
And the international wrong.<br>
<br>
Faces along the bar<br>
Cling to their average day:<br>
The lights must never go out,<br>
The music must always play,<br>
All the conventions conspire <br>
To make this fort assume<br>
The furniture of home;<br>
Lest we should see where we are,<br>
Lost in a haunted wood,<br>
Children afraid of the night<br>
Who have never been happy or good.<br>
<br><br>
The windiest militant trash<br>
Important Persons shout<br>
Is not so crude as our wish:<br>
What mad Nijinsky wrote<br>
About Diaghilev<br>
Is true of the normal heart;<br>
For the error bred in the bone<br>
Of each woman and each man<br>
Craves what it cannot have,<br>
Not universal love<br>
But to be loved alone.<br>
<br><br>
From the conservative dark<br>
Into the ethical life<br>
The dense commuters come,<br>
Repeating their morning vow;<br>
“I will be true to the wife,<br>
I’ll concentrate more on my work,""<br>
And helpless governors wake<br>
To resume their compulsory game:<br>
Who can release them now,<br>
Who can reach the deaf,<br>
Who can speak for the dumb?<br>
<br><br>
All I have is a voice<br>
To undo the folded lie,<br>
The romantic lie in the brain<br>
Of the sensual man-in-the-street<br>
And the lie of Authority<br>
Whose buildings grope the sky:<br>
There is no such thing as the State<br>
And no one exists alone;<br>
Hunger allows no choice<br>
To the citizen or the police;<br>
We must love one another or die.<br>
<br><br>
Defenceless under the night<br>
Our world in stupor lies;<br>
Yet, dotted everywhere,<br>
Ironic points of light<br>
Flash out wherever the Just<br>
Exchange their messages:<br>
May I, composed like them<br>
Of Eros and of dust,<br>
Beleaguered by the same<br>
Negation and despair,<br>
Show an affirming flame.<br>
"
196-197,53rd St between 3rd Ave and Lexington,Learning to Read New York,"<iframe src=""https://www.google.com/maps/embed?pb=!1m0!3m2!1sen!2sus!4v1446476276451!6m8!1m7!1skd3AN9KPu5fSqrAPAm754g!2m2!1d40.75813333212459!2d-73.97042709851337!3f57!4f0!5f0.7820865974627469"" width=""600"" height=""450"" frameborder=""0"" style=""border:0"" allowfullscreen></iframe>","""In History's Vicinity"" by Richard Bowes from Best Gay Stories 2010",,"The Bird Circuit of gay bars: The Blue Parrot on Fifty-third between Third and Lexington, the Golden Pheasant on Forty-eighth Street, the Swan—all in the neighborhood of the Third Avenue El. ","The Bird Circuit of gay bars: The Blue Parrot on Fifty-third between Third and Lexington, the Golden Pheasant on Forty-eighth Street, the Swan—all in the neighborhood of the Third Avenue El. The East Side bars tended to be dressy, and their customers were conservatively dressed in bow ties, blazers, or fluffy sweaters. The “bird bars” usually started coming to life between eleven-thirty and midnight when the plays let out. Often the men in the bar could be found shoulder to shoulder dancing, singing tunes from such Broadway musicals as South Pacific or Kiss Me, Kate in unison with the jukebox."
197,E 65th St & 3rd Ave,Learning to Read New York,"<iframe src=""https://www.google.com/maps/embed?pb=!1m0!3m2!1sen!2sus!4v1446476404557!6m8!1m7!1sSw222LLXo0_Z43mzb0fhVQ!2m2!1d40.76503120424923!2d-73.96404982318785!3f34!4f0!5f0.7820865974627469"" width=""600"" height=""450"" frameborder=""0"" style=""border:0"" allowfullscreen></iframe>","""In History's Vicinity"" by Richard Bowes from Best Gay Stories 2010",,"I’d walk down Third Avenue. In the East Sixties, guys stood casually on street corners, paused significantly in doorways, gave sidelong glances: all very discreet. Eyes tracked me from the windows of the bird bars ... In those bars Piaf sang on the jukebox, men in suits sat at the bar ...","I’d walk down Third Avenue. In the East Sixties, guys stood casually on street corners, paused significantly in doorways, gave sidelong glances: all very discreet. Eyes tracked me from the windows of the bird bars ... In those bars Piaf sang on the jukebox, men in suits sat at the bar ... Down the Avenue from the bars at Fifty-Third and Third was a world famous chicken run. Young boys stood in the cold in sneakers and thin jackets, waited under awnings, stared out the windows of seedy coffee shops and knew just who I was."
216,E 59th St & Lexington Ave,Learning to Read New York,"<iframe src=""https://www.google.com/maps/embed?pb=!1m0!3m2!1sen!2sus!4v1446476518776!6m8!1m7!1seHaylH_THmrFAb2wSeie3g!2m2!1d40.7616631!2d-73.9665155!3f298!4f0!5f0.7820865974627469"" width=""600"" height=""450"" frameborder=""0"" style=""border:0"" allowfullscreen></iframe>","Queer Street: Rise and Fall of an American Culture, 1947–1985 by James McCourt, 2014",,"For open secret tea-room ceremonies. Tea ceremonies are properly held in tea houses, true, but the tea room at Port Authority was the side of a half-floor in the fabled Dakota Apartments overlooking Central Park West. ","For open secret tea-room ceremonies. Tea ceremonies are properly held in tea houses, true, but the tea room at Port Authority was the side of a half-floor in the fabled Dakota Apartments overlooking Central Park West. Two seemingly endless rows of urinals, as many as at Radio City Music Hall—with as many semaphoric penises as a full kick line of Rockettes’ legs ... and in the stalls, you might say, apropos tea ceremonies, there was a kind of Zen operating insofar as the mediator was summoned to contemplation of a symmetry without the burden of any attendant meaning...So he’s in the tea room at 59th and Lexington, of course on the uptown side, and he sees scribbled on the stall wall, For a nice accomodation [sic], call Regent 4—, and for the first time in his life is impelled to scribble a reply: There are two c’s and two m’s in accommodation, Mary...Old cops always called the tea rooms the nickelodeons."
216,W 42nd St & 8th Ave,Learning to Read New York,"<iframe src=""https://www.google.com/maps/embed?pb=!1m0!3m2!1sen!2sus!4v1446476667225!6m8!1m7!1srkOt-1YGnwpLT2dAmN1vtQ!2m2!1d40.75728388612141!2d-73.98992631963633!3f207!4f0!5f0.7820865974627469"" width=""600"" height=""450"" frameborder=""0"" style=""border:0"" allowfullscreen></iframe>","Queer Street: Rise and Fall of an American Culture, 1947–1985 by James McCourt, 2014",,"One’s social performance in subway toilets...I’ve never understood how anybody can do business in such places, with express trains roaring by at regular intervals.
",
216,42nd St between Broadway and 8th Ave,Learning to Read New York,"<iframe src=""https://www.google.com/maps/embed?pb=!1m0!3m2!1sen!2sus!4v1446477110707!6m8!1m7!1s-Fto1vUQRyj5jpmXBzaU9g!2m2!1d40.75618265345969!2d-73.98729982244501!3f333!4f0!5f0.7820865974627469"" width=""600"" height=""450"" frameborder=""0"" style=""border:0"" allowfullscreen></iframe>","New York Hustlers: Masculinity and Sex in Modern America by Barry Reay, 2010",,"Santos measures his success by his earnings. He is sure that he has done as well, if not better, than most of the boys who loiter around Forty-second Street between Broadway and Eighth Avenue, a street known by homosexuals as the “Meat Market.” ","Santos measures his success by his earnings. He is sure that he has done as well, if not better, than most of the boys who loiter around Forty-second Street between Broadway and Eighth Avenue, a street known by homosexuals as the “Meat Market.” Here hoodlum homosexuals meet prospective customers and arrange the details of payment, the form of sex play, and the place where it is to occur. Santos says that his usual fee is $1. On one evening he took in as much as $6 for three sexual experiences.

A few flagrantly exhibitionistic fairies are able to make a living through the sexual gratification of men who are interested in their type of service. Ordinarily, however, the hustler is the one who is paid by the “queen,” “bitch,” “fag,” or “fairy”—that is, by an effeminate exhibitionist who not only brazenly proclaims his homosexuality to the interested, but attempts to force it on the notice of others. Like the female prostitute, the effeminate male prostitute has a more masculine male prostitute somewhere in the offing to whom he contributes and who serves as his protector. Sometimes these protectors are gangsters. Emotional attachments between fairies of Santos’ type and their protectors are ephemeral affairs.
"
217,67 W 35th St,Learning to Read New York,"<iframe src=""https://www.google.com/maps/embed?pb=!1m0!3m2!1sen!2sus!4v1446477326313!6m8!1m7!1sAyAfVXTL8jA3BPU-pxb2Sw!2m2!1d40.75025290793637!2d-73.98678599293832!3f222!4f0!5f0.7820865974627469"" width=""600"" height=""450"" frameborder=""0"" style=""border:0"" allowfullscreen></iframe>","POPism: The Warhol '60s by Andy Warhol, 1980",,The big nude theater craze hit in ’69. It was only the year before that police had stood by in San Francisco to arrest the Living Theater performers if they so much as started taking their clothes off. ,The big nude theater craze hit in ’69. It was only the year before that police had stood by in San Francisco to arrest the Living Theater performers if they so much as started taking their clothes off. Then all of a sudden the new thing was for performers to take all their clothes off and dance around completely naked on stage in long-playing well-advertised shows like <i>Oh! Calcutta!</i> and <i>Dionysus in ’69.</i>
218,138 W 42nd St,Learning to Read New York,"<iframe src=""https://www.google.com/maps/embed?pb=!1m0!3m2!1sen!2sus!4v1446478730669!6m8!1m7!1s21CBe1dqUrgcr1x3kwFnHw!2m2!1d40.75551511793438!2d-73.98571879615098!3f303!4f0!5f0.7820865974627469"" width=""600"" height=""450"" frameborder=""0"" style=""border:0"" allowfullscreen></iframe>","Times Square Red, Times Square Blue by Samuel Delany, 1999",,"The Bryant (that had featured “Live Sex Shows,” which, at five performances a day between ten and ten, were exactly that: a brown or black couple spent twenty minutes on a bare blue-lit stage, first the woman stripping for the man, then fellating him...","The Bryant (that had featured “Live Sex Shows,” which, at five performances a day between ten and ten, were exactly that: a brown or black couple spent twenty minutes on a bare blue-lit stage, first the woman stripping for the man, then fellating him, then his performing cunnilingus on her, and finally the two of them screwing in two or three positions, finishing—with pull-out orgasms for a few of the after-six shows—to polite applause from the largely forty-plus male audience, before the porn film started once more. At the back of the chest-high wall behind the last row of orchestra seats, usually some guy would give you a hand job or sometimes a blow job; there for a couple of weeks I gave my quota of both) was simply a south-side vacant lot."
218,Union Square,Learning to Read New York,"<iframe src=""https://www.google.com/maps/embed?pb=!1m0!3m2!1sen!2sus!4v1446479746081!6m8!1m7!1sDh5dFa-fjmziHAreE79Rxw!2m2!1d40.73566201106162!2d-73.98974931723453!3f235!4f0!5f0.7820865974627469"" width=""600"" height=""450"" frameborder=""0"" style=""border:0"" allowfullscreen></iframe>","""Union Square"" by Sara Teasdale",,"With the man I love who loves me not,<br>
      I walked in the street-lamps' flare;<br>
We watched the world go home that night<br>
      In a flood through Union Square.<br>
","With the man I love who loves me not,<br>
      I walked in the street-lamps' flare;<br>
We watched the world go home that night<br>
      In a flood through Union Square.<br><br>

I leaned to catch the words he said<br>
      That were light as a snowflake falling;<br>
Ah well that he never leaned to hear<br>
      The words my heart was calling.<br><br>

And on we walked and on we walked<br>
      Past the fiery lights of the picture shows —<br>
Where the girls with thirsty eyes go by<br>
      On the errand each man knows.<br><br>

And on we walked and on we walked,<br>
      At the door at last we said good-bye;<br>
I knew by his smile he had not heard<br>
      My heart's unuttered cry.<br><br>

With the man I love who loves me not<br>
      I walked in the street-lamps' flare —<br>
But oh, the girls who ask for love<br>
      In the lights of Union Square.<br>"
199,Central Park West,Learning to Read New York,"<iframe src=""https://www.google.com/maps/embed?pb=!1m0!3m2!1sen!2sus!4v1446480049613!6m8!1m7!1sFKlhZMUZ7pURLxlffRYbdw!2m2!1d40.77958704435663!2d-73.97383591407905!3f110!4f0!5f0.7820865974627469"" width=""600"" height=""450"" frameborder=""0"" style=""border:0"" allowfullscreen></iframe>","<i> Stonewall: The Riots that Sparked the Gay Revolution</i> by David Carter, 2004",,"Every night after dinner we go walk on Central Park West and we run into all of our friends, the people we work with, and half the West Side gay people— which were thousands—on Central Park West between 59th and 86th. ","Every night after dinner we go walk on Central Park West and we run into all of our friends, the people we work with, and half the West Side gay people— which were thousands—on Central Park West between 59th and 86th. In those days, there was one long bench from corner to corner, solid with gay men. Hundreds and thousands of them walked back-and-forth singularly, in couples, and in groups. "
199,41 E. 21st St,Learning to Read New York,"<iframe src=""https://www.google.com/maps/embed?pb=!1m0!3m2!1sen!2sus!4v1446480143329!6m8!1m7!1sPlT2thvOMbE2m4l67hT0Sg!2m2!1d40.73930839264159!2d-73.98828182648954!3f28.011268799706116!4f3.4528971286717507!5f0.7820865974627469"" width=""600"" height=""450"" frameborder=""0"" style=""border:0"" allowfullscreen></iframe>","<i>Queer Street: Rise and Fall of an American Culture, 1947-1985</i> by James McCourt, 2004",,"The senescent, semi-derelict pensioned-off civil servant queer from one of the many residential hotels in the neighborhood is sitting on the bench a mere two blocks south in Madison Square, at six on a summer morning. ","The senescent, semi-derelict pensioned-off civil servant queer from one of the many residential hotels in the neighborhood is sitting on the bench a mere two blocks south in Madison Square, at six on a summer morning. Sex still rages in the bushes and up against the trees, and particularly significantly in the thicket behind the Saint-Gaudens statue of Admiral Farragut (“Damn the torpedoes—full speed ahead!”) with his flaring long coat, pedestal and chair."
198,160 W 129th St,Learning to Read New York,"<iframe src=""https://www.google.com/maps/embed?pb=!1m0!3m2!1sen!2sus!4v1446480251972!6m8!1m7!1s2QQdfO63xCz1LPMNtd6jNg!2m2!1d40.81133040797307!2d-73.9459942782638!3f191!4f0!5f0.7820865974627469"" width=""600"" height=""450"" frameborder=""0"" style=""border:0"" allowfullscreen></iframe>","<i>Voguing and the House Ballroom Scene of New York City 1898-1992</i> by Tim Lawrence, 2011",Charles Henri Ford and Parker Tyler describe Harlem’s drag balls of the 1920s.,A scene whose celestial flavor and cerulean coloring no angelic painter or nectarish poet has ever conceived.,
198-199,Herald Square,Learning to Read New York,"<iframe src=""https://www.google.com/maps/embed?pb=!1m0!3m2!1sen!2sus!4v1446480397837!6m8!1m7!1sL9utSgKwQSUoiV7ZrHOK8Q!2m2!1d40.75082617751129!2d-73.9878099558815!3f320!4f0!5f0.7820865974627469"" width=""600"" height=""450"" frameborder=""0"" style=""border:0"" allowfullscreen></iframe>","<i>Gay New York: Gender, Urban Culture, and the Making of the Gay Male World, 1890-1940</i> by George Chauncey, 1994",,"The elaborate display windows that department stores began installing in the late nineteenth century quickly became the locus of one of the few acceptable street cultures for middle-class women, who could stroll down the street looking at them...","The elaborate display windows that department stores began installing in the late nineteenth century quickly became the locus of one of the few acceptable street cultures for middle-class women, who could stroll down the street looking at them and conversing with other browsers, their loitering in public space legitimized by its association with consumption. As men, gay men had less need to justify their presence on the streets, but they took advantage of the same legitimizing conventions. One man who had indicated his interest in meeting another might stop before a window and gaze at the display; the second could then join him and strike up a conversation in which they could determine whether they wanted to spend more time together. “Fairies hang out in the saloon opposite Bloomingdale’s,” a Macy’s saleswoman claimed in 1913, and, she added, the blocks of Third Avenue in the East Fifties, a marginal retail strip under the El, were “their favorite beat.” A study of arrests for homosexual activity in 1921 provides further evidence of the extent to which cruising was concentrated in retail shopping districts, for it revealed that the subway stations at Lexington and Fifty-ninth Street where Bloomingdale’s stood, Union Square (the site of numerous cheap retail outlets), and Herald Square where Macy’s, Gimbels, and Saks-34th Street were located, each accounted for more arrests than any other station, all together accounted for three-quarters of the arrests reported for all subway stations."
198,149th St & Frederick Douglass Blvd,Learning to Read New York,"<iframe src=""https://www.google.com/maps/embed?pb=!1m0!3m2!1sen!2sus!4v1446480483209!6m8!1m7!1sQa_WrHp6WyroNoMb-pmMYg!2m2!1d40.8253766!2d-73.9400549!3f17!4f0!5f0.7820865974627469"" width=""600"" height=""450"" frameborder=""0"" style=""border:0"" allowfullscreen></iframe>","<i>All-Night Party: The Women of Bohemian Greenwich Village and Harlem, 1913-1930</i> by Andrea Barnet, 1993",Carl Van Vechten was a writer and artistic photographer and “patron” of the Harlem Renaissance and the literary executor of Gertrude Stein.,Van Vechten’s flat in Harlem for his affairs with men was painted black with silver stars on the ceiling for nocturnal trysts. ,
198,Pennsylvania Station,Learning to Read New York,"<iframe src=""https://www.google.com/maps/embed?pb=!1m0!3m2!1sen!2sus!4v1446480581628!6m8!1m7!1sBzw7YWeu832DEN8DFMUQ6Q!2m2!1d40.75152649415489!2d-73.99394114022618!3f154!4f0!5f0.7820865974627469"" width=""600"" height=""450"" frameborder=""0"" style=""border:0"" allowfullscreen></iframe>","<i>Gay New York: Gender, Urban Culture, and the Making of the Gay Male World, 1890-1940</i> by George, Chauncey, 1994",,"In 1912, agents of the Pennsylvania Railroad cut holes in the ceiling of the men’s room at their Cortlandt Ferry house in order to spy on men using the facilities. ",
200,72nd St & Broadway,Learning to Read New York,"<iframe src=""https://www.google.com/maps/embed?pb=!1m0!3m2!1sen!2sus!4v1446480701238!6m8!1m7!1sO6-goIXkhp19fccR3YlptA!2m2!1d40.7787927!2d-73.9820623!3f0!4f0!5f0.7820865974627469"" width=""600"" height=""450"" frameborder=""0"" style=""border:0"" allowfullscreen></iframe>","<i>The Young and The Evil</i> by Henri-Ford, Charles and Parker Tyler, 1933 ","An excerpt from <i>The Young and The Evil</i>, a groundbreaking novel published in 1933, thought by many to mark the birth of the genre, “gay lit.”",And here on Broadway and 72nd Street <i>murderpiss</i> beautiful boys grow out of dung ... They push flesh into eternity and sidestep automobiles. ,"And here on Broadway and 72nd Street <i>murderpiss</i> beautiful boys grow out of dung ... They push flesh into eternity and sidestep automobiles. I bemoan them most under sheets at night when their eyes rimmed with masculinity see nothing and their lymphlips are smothered by the irondomed sky. Poor things, their genitals only peaceful when without visiting cards. "
