Rank,Page,Tour,Location,Streetview Embed Code,Source,Context,Preview,Quote,
,,,Jamaica LIRR Station ,,Maloney,,"I ride the A train out from Manhattan to my summer bungalow in the Rockaways. Crossing Jamaica Bay, I get a little lightheaded. The subway car, which has been chugging along over the bay, plunges downward with a jerk, as if it’s headed straight for the bottom. Then abruptly, almost at the waterline, the car seems to skim right across the top of the waves. It’s as if a gust of wind could swirl up and tip it over. Hitting open water in a crowded New York City subway car is one of the strangest satisfactions of metropolitan life.",,
,454,Arts & Letters,110 Columbia Heights,"<iframe src=""https://www.google.com/maps/embed?pb=!1m0!3m2!1sen!2sus!4v1447020079522!6m8!1m7!1sTU1sQDp7waSRsxqCiRwdMg!2m2!1d40.69956014691292!2d-73.99573607834745!3f9!4f0!5f0.7820865974627469"" width=""600"" height=""450"" frameborder=""0"" style=""border:0"" allowfullscreen></iframe>",Mariani,"In a letter to his mother and grandmother in 1924, Hart Crane wrote of his home in Brooklyn: ""Just imagine looking out your window directly on the East River with nothing intervening between your view of the Statue of Liberty, way down the harbour, and the marvelous beauty of Brooklyn Bridge close above you on your right! All of the great new skyscrapers of lower Manhattan are marshaled directly across from you, and there is a constant stream of tugs, liners, sail boats, etc in procession before you on the river! It's really a magnificent place to live. This section of Brooklyn is very old, but all the houses are in splendid condition and have not been invaded by foreigners...""","Crane confessed to having to stitch together for “The Tunnel” the hundreds of notes he’d written while swinging on the subway straps as he passed under the East River, the wheels screeching against the rails, the agate lights blinking in the midnight tunnel, the car deserted, as he rode back to his apartment after a night in Manhattan.",,
,,x,1 West 67th St ,"<iframe src=""https://www.google.com/maps/embed?pb=!1m0!3m2!1sen!2sus!4v1447136044176!6m8!1m7!1shchPfYZRLOEM1zM0TyC9dA!2m2!1d40.77332735512823!2d-73.97900734716168!3f19!4f0!5f0.7820865974627469"" width=""600"" height=""450"" frameborder=""0"" style=""border:0"" allowfullscreen></iframe>",Marquis,,"One evening in January 1916, during dinner with the Arensbergs at the Cafe des Artistes at 1 West 67th Street, Duchamp leaps up and impulsively signs his own name to a huge old-fashioned battle scene painted on the wall behind him. The gesture, he explains, makes the mural his own readymade; it has “everything except taste.”",,
,572,The Biz,Times Square,,"Mayakovsky, <i>Discovery</i>",,"To support the alibi of “business,” the incipient tradition of Fantastic Technology is disguised as pragmatic technology. The paraphernalia of illusion that have just subverted Coney Island’s nature into an artificial paradise...","To support the alibi of “business,” the incipient tradition of Fantastic Technology is disguised as pragmatic technology. The paraphernalia of illusion that have just subverted Coney Island’s nature into an artificial paradise—electricity, air-conditioning, tubes, telegraphs, tracks and elevators—reappear in Manhattan as paraphernalia of efficiency to convert raw space into office suites.",
,,x,,,McCourt,,Barbara Stanwyck lay strangled on her bed on Sutton Place while the BMT rumbled over the Queensboro Bridge.,,
,,Arts & Letters,101 Crosby Street,"<iframe src=""https://www.google.com/maps/embed?pb=!1m0!3m2!1sen!2sus!4v1447134516098!6m8!1m7!1sbNeK2EoKCmzebLHTa5hMIQ!2m2!1d40.72368135736523!2d-73.99712454112853!3f143.16!4f0!5f0.7820865974627469"" width=""600"" height=""450"" frameborder=""0"" style=""border:0"" allowfullscreen></iframe>",McGuingan,"During the autumn of 1982, Basquiat lived like a hermit in a loft on Crosby Street in SoHo. ''I had some money; I made the best paintings ever,'' he says now. ''I was completely reclusive, worked a lot, took a lot of drugs. I was awful to people.''","One dealer, visiting Jean-Michel Basquiat’s loft and noting his fondness for health food, went away and came back with a big jar of fruits and nuts. ‘‘But what she really wanted were my paintings,’’ he says. ‘‘She tried to tell me that her chauffeur, who was black, worked with her in her gallery, not that he was her driver.’’ As she walked out of his door in defeat, Basquiat leaned out his window and dumped the contents of the jar on her head.",,
,,Animal New York,Cornelia St & 6th Ave,"<iframe src=""https://www.google.com/maps/embed?pb=!1m0!3m2!1sen!2sus!4v1447127118789!6m8!1m7!1sf-R-Idi3AerRhxsfKoqn6w!2m2!1d40.73158432381575!2d-74.00170836336167!3f279.9653693300177!4f-3.8138540192051664!5f0.7820865974627469"" width=""600"" height=""450"" frameborder=""0"" style=""border:0"" allowfullscreen></iframe>",McInerney,"<i>Bright Lights, Big City</i> is one of the only major American novels written in the second person. In this scene, you are turning the corner from 6th Ave to Cornelia St with a former co-worker on an informal date. Later that night, you try to make a move on her, but the two valiums you took catch up to you. ","You pass Ottomanelli’s Meats, where the corpses of small animals hang in the window: unskinned rabbits, hairless fetal pigs, plucked fowl with yellow feet.",,
,25,x,,,McInerney,,"Out into the sunlight of Fifth Avenue and the Plaza, a gargantuan white chateau rising in the middle of the island like a New Money dream of the Old World.",,
,87,x,455 Madison Ave,,McInerney,,You pass the Helmsley Palace—the shell of old New York transparently veiling the hideous erection of a real estate baron.,You pass the Helmsley Palace—the shell of old New York transparently veiling the hideous erection of a real estate baron.<br><br>Leopna Helmsley: The Queen of Mean ,
,261,Under the Influence,42nd and Fifth ave,"<iframe src=""https://www.google.com/maps/embed?pb=!1m0!3m2!1sen!2sus!4v1446847350292!6m8!1m7!1sD3SMdEy7uLHcdrYed9x-gA!2m2!1d40.7535030817785!2d-73.98093079094254!3f119!4f0!5f0.7820865974627469"" width=""600"" height=""450"" frameborder=""0"" style=""border:0"" allowfullscreen></iframe>","McInerney, Bright Lights,",,On Forty-second near Fifth a kid falls into stride beside you.<br> “Loose joints. Genuine Hawaiian sens. Downers and uppers.”,,
,,Alone Together,213 Park Ave,"<iframe src=""https://www.google.com/maps/embed?pb=!1m0!3m2!1sen!2sus!4v1447106941986!6m8!1m7!1sF1t4YVAKdK3y2xQjmrqlpA!2m2!1d40.75460629319861!2d-73.97557968216212!3f352.381744042508!4f7.301079609490543!5f0.7820865974627469"" width=""600"" height=""450"" frameborder=""0"" style=""border:0"" allowfullscreen></iframe>",McNeil and McCain,"Max's Kansas City was an infamous bar and eatery at 213 Park Avenue South, frequented by bohemian artists and dissidents of the 1970s and 1960s. ","When I wasn’t getting laid elsewhere I went to Max’s Kansas City every night. It was a bar and restaurant two blocks away from where I lived and you could sit there all night and bring yourself coffee. It was free. And you always signed the check and never paid the bill. I felt so guilty, I had an unpaid bill of about two or three thousand dollars. I guess that was a lot in the sixties. ",,
,,Under the Influence,275 Church St,,McNeil and McCain,,"When you went over to La Monte and Marian’s place, you were there for a minimum of seven hours—probably end up to be two or three days. It wasa very Turkish type scene. It was a pad with everything on the floor andbeads and great hashish and street people coming and scoring—and this droning music going on. La Monte had this whole thing where he would do a performance that would go on for days and he would have people droning with him. Droning is holding a single note for a whole long time. People would just come in and then be assigned to drone.<br><br>La Monte Young was the best drug connection in New York. He had the best drugs—the best! Great big acid pills, and opium, and grass too.<br><br>La Monte Young: “I was—so to speak—the darling of the avant-garde. Yoko Ono was always saying to me, ‘If only I could be as famous as you.’”",,
,,W-Cinematic New York,,,Miller (Supreme),,"A long foyer led to six sets of bronze-trimmed doors. Passing through them, patrons entered a grand rotunda. (Roxy threatened to fire any of his ushers who referred to it as “the lobby.”) ",,
,45,Animal NY,608 W 48th St,"<iframe src=""https://www.google.com/maps/embed?pb=!1m0!3m2!1sen!2sus!4v1447022795316!6m8!1m7!1sPHeWgbCR8I4S4f4pwlGUUw!2m2!1d40.76488557373034!2d-73.99616338620444!3f344!4f0!5f0.7820865974627469"" width=""600"" height=""450"" frameborder=""0"" style=""border:0"" allowfullscreen></iframe>",Mitchell,"According to the 1995 guide book, <i>Everything Has Its Price: The Indispensible Price Guide for Anyone Who Ever Wondered, ""How Much Does that Cost?""</i> lions can be rented for anywhere between $1,000 and $7,000 per day.  ",At 608 West 48th Street you can rent a lion for $250 a day.,,
,,Animal New York,Flushing Meadows-Corona Park,"<iframe src=""https://www.google.com/maps/embed?pb=!1m0!3m2!1sen!2sus!4v1447128795073!6m8!1m7!1sN--VGf4ExbZ4nAytgGOs3g!2m2!1d40.74571097758661!2d-73.84719823877501!3f66.31267523320909!4f12.616605832548373!5f0.7820865974627469"" width=""600"" height=""450"" frameborder=""0"" style=""border:0"" allowfullscreen></iframe>",Monaghan,"Over 44 million people attended the exhibitions of the 1939 World's Fair at Flushing Meadows-Corona Park. According to the official New York World's Fair pamphlet:
<br><br>
<i>The eyes of the Fair are on the future — not in the sense of peering toward the unknown nor attempting to foretell the events of tomorrow and the shape of things to come, but in the sense of presenting a new and clearer view of today in preparation for tomorrow; a view of the forces and ideas that prevail as well as the machines.</i>","Frank (Bring ‘em Back Alive) Buck has made his greatest capture. He has brought the whole jungle back alive to the Fair. Here are thousands of rare specimens of wild life from the jungles ... 1,000 rhesus monkeys living on a miniature mountain ... Apart from the jungle camp inhabited by native hunters there is a special feature exhibit of trained animals where it is shown to what extent savage beasts can be “educated.”<br><b>An advertisement for one of the Fair's shows reads: Nature’s Mistakes: An assemblage of animal freaks from all corners of the world ... housed in an auditorium with a maze-like pit area where the freaks move about in seeming freedom. There you see a hog without any ham, a bull with elephant feet, a steer with its heart in its neck, a cat with 28 toes
and 28 claws, a bull with human skin (so transparent that veins are visible, insured by Lloyd’s of London for $15,000) ... None of these animals have been mutilated to make freaks.",,
,,x,,,Morand,,"History is forgotten. “Nature, gods, the sea, are replaced by new words that must be mastered. In Paris there is but one which the skies spasmodically teach us—Citroën. In New York there are Lasky, Ziegfeld, Goldwyn, Mayer.” ",,
,170,Ghost Town,Hudson River & 40thst,"<iframe src=""https://www.google.com/maps/embed?pb=!1m0!3m2!1sen!2sus!4v1447022235271!6m8!1m7!1sI98JGUAwvw8dAhIS8Jco6w!2m2!1d40.76099187842321!2d-74.00218502083133!3f291!4f0!5f0.7820865974627469"" width=""600"" height=""450"" frameborder=""0"" style=""border:0"" allowfullscreen></iframe>","Morris, Incredible",,"In 1853, foresighted Charles E. Appleby purchased from the city a grant of land then mainly under the waters of the Hudson River between 39th and40th Street. According to the terms of his grant, Appleby was required to fill in streets and build wharves and bulkheads. This work was left undone by Appleby and his heirs. Eventually, the city filled in the area, built streets, constructed piers. As a result, in 1928 Appleby’s descendants sued the city for trespass, and ultimately received more than three million dollars in awards, interest and damages. They still own the property, which today—largely because of the city’s trespass—is valued at more than 150 times what it cost their ancestor.",,
,308-309,New Yorkers,127 Prince,"<iframe src=""https://www.google.com/maps/embed?pb=!1m0!3m2!1sen!2sus!4v1447152653858!6m8!1m7!1shAhRTSiD_TBY6vl13nBm_A!2m2!1d40.72547273728818!2d-74.00030252305916!3f40!4f0!5f0.7820865974627469"" width=""600"" height=""450"" frameborder=""0"" style=""border:0"" allowfullscreen></iframe>","Morris, Incredible","FOOD was an artist-run restaurant in SoHo from 1971 to 1974. FOOD was said to inspire others who create food art, or work in the field of relational art. Many famous artists and performers, such as Donald Judd, Robert Rauschenberg and John Cage created meals at FOOD. The cooking and the meals themselves were considered to be works of performance art. ","FOOD restaurant opened at 127 Prince Street on the corner of Wooster Street
in October of 1971 and was run by the original founders for three years.<br><br>Famous Sunday night guest artist meals at FOOD. One was the serving of live brine shrimp in hollowed out hard-boiled eggs. The other was Matta-Clark’s “Bone Meal,” consisting of a variety of bone-based dishes such as chicken bones, beef bones stuffed with wild rice and mushrooms, from legs, marrow bones. The meal started with Gordon-made aspic, went on to oxtail soup, and then the bone platter. Richard Peck was in the back scrubbing bones that people had finished eating and Hisachika Tasahashi drilled holes through the bones, which were stung on rope and handed to the customers as necklaces so they could wear their dinners home.",,
,238&239,x,,,"Morris, Incredible",,"The Brooklyn Bridge’s arches’ interiors are damp, gloomy vaults and are weirdly medieval in appearance, especially the abandoned wine cellars behind the studded heavy steel doors in the arch at North William Street, just off the rear of the old World Building. The arches and the crooked little streets that bend and twist around them give that part of town something of the look of medieval Prague. When you get down into the wine cellars and away from the sound, you’re in a “Cast of Amontillado” setting. The damp drips, walls glitter, footfalls echo, shadows distort on ancient vaults.There’s a brief history of the bridge wine cellars on one of the deep inner walls. It’s patchy and flaked, with painted vine trellises all around it crawling up the wet walls. It says: “Legend of Oechs Cellars: These cellars were built in 1876, about seven years prior to the official opening of Brooklyn Bridge in 1883. From their inception they housed the choicest wines in New York City.” ",,
,,Arts & Letters,119 West 31st Street,"<iframe src=""https://www.google.com/maps/embed?pb=!1m0!3m2!1sen!2sus!4v1447134784094!6m8!1m7!1sXSVaxGO5q3cqAgLc-wUyFg!2m2!1d40.74828186726961!2d-73.99008216177984!3f25!4f0!5f0.7820865974627469"" width=""600"" height=""450"" frameborder=""0"" style=""border:0"" allowfullscreen></iframe>","Morris, Manhattan ‘45, p. 255.","In 1941, Gimbals conducted the sale of William Randolph Hearst Collection, requiring that the department store rebuild its 5th floor to accommodate the collection's 15,000 pieces of arguably priceless art. The 1943 sale of Rembrandt's <i>Portrait of a Young Child</i> was a further stunt to get publicity with the slogan, ""Nobody but nobody undersells Gimbels."" The department store closed perminantly in 1986. The Gimbels name was worth $5,000. ","In 1942, Gimbel’s and Macy’s begins selling old master paintings. Gimbel’s offers one of its Rembrandts at $9,999.99.",,
,36,x,TBD,,Moscow,,The last relics of the a primeval forest that blanketed Manhattan when the white man first arrived survive precariously on forty acres along the Bronx River gorge in the South Bronx.,"The last relics of the a primeval forest that blanketed Manhattan when the white man first arrived survive precariously on forty acres along the Bronx River gorge in the South Bronx. The trees, stately Canadian hemlocks, rise on one of the few sites in the nation that have never been logged. The virgin forest dates back to the end of the Ice Age some 20,000 years ago.",
,152,x,,,Mumford (City in History),,"The whole organization of the metropolitan community is designed to kill spontaneity and self-direction. You stop on the red and go on the green.
You see what you are supposed to see, and think what you are supposed 
to think ... To choose, to select, to discriminate, to exercise prudence or continence or forethought, to carry self-control to the point of abstinence, have standards other than those of the [mass] market, and to set limits other than those of immediate consumption—these are the impious heresies that would challenge the whole megalopolitan myth and deflate its economy. In such a free society Henry Thoreau must rank as a greater public enemy than Karl Marx.
",,
,,Arts & Letters,217 W 14th St,"<iframe src=""https://www.google.com/maps/embed?pb=!1m0!3m2!1sen!2sus!4v1447135611323!6m8!1m7!1sRYW4141FniFfqCK_RBrSgg!2m2!1d40.73890741174242!2d-74.00051513060686!3f208!4f0!5f0.7820865974627469"" width=""600"" height=""450"" frameborder=""0"" style=""border:0"" allowfullscreen></iframe>",Myers,"Duchamp moved into a fifth floor studion on W 14th St in 1942, and kept it until his death in 1968.","One day I ask Marcel Duchamp how many people he thinks <i>really</i> liked avant-garde art and he replies, “Oh, maybe ten in New York and one or two in New Jersey.”",,
,6,New Yorkers,45 West 56th St,"<iframe src=""https://www.google.com/maps/embed?pb=!1m0!3m2!1sen!2sus!4v1447093516607!6m8!1m7!1stL7mCMAVpocztPTolHRmCg!2m2!1d40.76282330261005!2d-73.97572577553218!3f297!4f0!5f0.7820865974627469"" width=""600"" height=""450"" frameborder=""0"" style=""border:0"" allowfullscreen></iframe>",Myers,"From his 56th St apartment, André Breton wrote to his friend Benjamin Péret, “I don’t have to tell you how I feel about New York, its sites and customs. I sometimes wonder if you were worse off in Rennes [prison] than I am pacing five or six times a day down Fifty-seventh street.”","Breton continued to live in New York City; he remained totally French, untouched by his residence in America, almost as through he had never left Paris.","Breton continued to live in New York City; he remained totally French, untouched by his residence in America, almost as through he had never left Paris.",
,216,Learning to Read New York,42nd St between Broadway and 8th Ave,"<iframe src=""https://www.google.com/maps/embed?pb=!1m0!3m2!1sen!2sus!4v1446477110707!6m8!1m7!1s-Fto1vUQRyj5jpmXBzaU9g!2m2!1d40.75618265345969!2d-73.98729982244501!3f333!4f0!5f0.7820865974627469"" width=""600"" height=""450"" frameborder=""0"" style=""border:0"" allowfullscreen></iframe>","New York Hustlers: Masculinity and Sex in Modern America by Barry Reay, 2010","Reay compares the earnings of one of the more famous sex workers  who ""says that his usual fee is $1 [and] on one evening he took in as much as $6 for three sexual experiences""","Santos measures his success by his earnings. He is sure that he has done as well, if not better, than most of the boys who loiter around Forty-second Street between Broadway and Eighth Avenue, a street known by homosexuals as the “Meat Market.” ","Santos measures his success by his earnings. He is sure that he has done as well, if not better, than most of the boys who loiter around Forty-second Street between Broadway and Eighth Avenue, a street known by homosexuals as the “Meat Market.” Here hoodlum homosexuals meet prospective customers and arrange the details of payment, the form of sex play, and the place where it is to occur. Santos says that his usual fee is $1. On one evening he took in as much as $6 for three sexual experiences.
<br>
A few flagrantly exhibitionistic fairies are able to make a living through the sexual gratification of men who are interested in their type of service. Ordinarily, however, the hustler is the one who is paid by the “queen,” “bitch,” “fag,” or “fairy”—that is, by an effeminate exhibitionist who not only brazenly proclaims his homosexuality to the interested, but attempts to force it on the notice of others. Like the female prostitute, the effeminate male prostitute has a more masculine male prostitute somewhere in the offing to whom he contributes and who serves as his protector. Sometimes these protectors are gangsters. Emotional attachments between fairies of Santos’ type and their protectors are ephemeral affairs.
",
,698,City on Fire,St Patrick's Cathedral,,"New York Undercover: Private Surveillance in the Progressive Era by Jennifer Front, 2009","The failed St. Patrick's Cathedral bombing marked the beginning of attacks by Galleani's followers in New York City. Over the next several months, bombings took place at several New York City sites, including police stations, churches, and courthouses. On November 14, 1914, a bomb was placed in the Tombs police court, under the chair of Magistrate Campbell, who had sentenced an anarchist for inciting to riot. In January 1915, police uncovered a plot to blow up St. Patrick's Cathedral in New York, and a copy of Galleani's bomb-making manual <i>La Salute è in voi!</i> was found at a suspect's house.","On October 3, 1914, a bomb exploded in St. Patrick’s Cathedral. On November 11, the anniversary of the Haymarket executions, the Bronx Courthouse was bombed.","On October 3, 1914, a bomb exploded in St. Patrick’s Cathedral. On November 11, the anniversary of the Haymarket executions, the Bronx Courthouse was bombed.",
,698,City on Fire,Black Tom Island in New York Harbor,,"New York Undercover: Private Surveillance in the Progressive Era by Jennifer Front, 2009","The Black Tom explosion was an act of sabotage by German agents to destroy American-made munitions that were to be supplied to the Allies in World War I. Allegedly, two of the guards at Black Tom and Krstoff, himself a US Army Vet, were in fact German agents. ","In the early morning hours of Sunday, July 30, 1916, a massive explosion shattered thousands of windows throughout Lower Manhattan","In the early morning hours of Sunday, July 30, 1916, a massive explosion shattered thousands of windows throughout Lower Manhattan, and some as far north as Times Square. The rumble was felt as close as Jersey City and as far away as Philadelphia. Millions of tons of war materials and explosives, stored on Black Tom Island in New York Harbor, exploded. Investigators initially blamed spontaneous combustion; the search, however, conducted in large measure by the New York City Police Department’s bomb squad, eventually zeroed in on Michael Kristoff, a citizen of the Austro-Hungarian Empire.",
,168,New Yorkers,192 Columbia Heights,"<iframe src=""https://www.google.com/maps/embed?pb=!1m0!3m2!1sen!2sus!4v1447023948601!6m8!1m7!1sQYohVJ9BpbSYIbbte6UPSg!2m2!1d40.69725982070493!2d-73.9968657949722!3f304!4f0!5f0.7820865974627469"" width=""600"" height=""450"" frameborder=""0"" style=""border:0"" allowfullscreen></iframe>",Nichols,"“Each Lego brick represents an apartment,"" Mailer explained. ""There’d be something like twelve thousand apartments. The philosophers would live at the top. The call girls would live in the white bricks, and the corporate executives would live in the black....Once it was cabled up, those who were adventurous could slide down. It would be great fun to start the day off. Put Starbucks out of business.” Mailer's Lego-city remained in his apartment for over 30 years until his death. The model's fate is unknown.","In his Brooklyn Heights apartment, Norman Mailer constructed a Lego- block model of his 15,000-unit apartment building in the pure-geometry style International Modernism, as an act of protest. After a year or so of slamming away at the modern “Kleenex box” school of architecture, Mailer decided to demonstrate the kind of city he thinks architects should be building. Using children’s building blocks with aluminum beams here and there to provide structural support, he built a six-foot sculptural model of his dream city.",,
,80&81,The Biz,515 Madison Ave,"<iframe src=""https://www.google.com/maps/embed?pb=!1m0!3m2!1sen!2sus!4v1447155257837!6m8!1m7!1sLtCVUv8_4SAI-BqJ767vyA!2m2!1d40.76002607571678!2d-73.97401509681157!3f126!4f0!5f0.7820865974627469"" width=""600"" height=""450"" frameborder=""0"" style=""border:0"" allowfullscreen></iframe>",O'Hara,,"515 Madison Avenue
<br><br>door to heaven? portal
<br><br>stopped realities and eternal licentiousness<br><br>
or at least the jungle of impossible eagerness
<br><br>your marble is bronze and your lianas elevator cables<br><br>swinging from the myth of ascending<br><br>
I would join
<br><br>or declining the challenge of racial attractions
<br><br>they zing on (into the lynch, dear friends)
<br><br>while everywhere love is breathing draftily
<br><br>like a doorway linking 53rd with 54th<br><br>
the east-bound with the west-bound traffic by 8,000,000s<br><br> o midtown tunnels and the tunnels, too, of Holland",,
,177,,,,O'Hara,,I love this hairy city.<br> It’s wrinkled like a detective story<br> and noisy and getting fat and smudged lids hood the sharp hard black eyes. <br>,,
