Rank,Page,Tour,Location,Streetview Embed Code,Source,Context,Preview,Quote,
,254,Under the Influence,east 78th and third ave,"<iframe src=""https://www.google.com/maps/embed?pb=!1m0!3m2!1sen!2sus!4v1446845364996!6m8!1m7!1stT4YAqm6Vpa70M-qcKKVfQ!2m2!1d40.7735957!2d-73.9577825!3f60!4f0!5f0.7820865974627469"" width=""600"" height=""450"" frameborder=""0"" style=""border:0"" allowfullscreen></iframe>",Falter,https://www.youtube.com/watch?v=niuNlPo1q9M,"Paul McCartney: “We’d hear people say, ‘You can get anything off him, any pills you want.’ It was a big racket. The song was a joke about this fellow who cured everyone of everything with all these pills and tranquilizers. He just kept New York high.” ","Paul McCartney: “We’d hear people say, ‘You can get anything off him, any pills you want.’ It was a big racket. The song was a joke about this fellow who cured everyone of everything with all these pills and tranquilizers. He just kept New York high.” John Lennon paid sardonic tribute to an actual New York doctor. His real name was Charles Roberts, whose unorthodox prescriptions had made him a great favorite of Andy Warhol’s entourage and, indeed, of The Beatles themselves, whenever they passed through town. In fact, the name was based on the New York Dr. Feelgood character Dr. Robert Freymann, whose discreet East 78th Street clinic was conveniently located for Jackie Kennedy and other wealthy Upper East Siders from Fifth Avenue and Park to stroll over for their vitamin B-12 shots, which also happened to contain a massive dose of amphetamine. Dr. Robert’s reputation spread and it was not long before visiting Americans told John and Paul about him.<br><br> German born Robert Freymann, sometimes known as Dr. Robert or “The Great White Father” (reportedly because of having a tuft of white hair), continued his practice in New York for many years administering legal amphetamines in larger than needed doses to mostly well-to-do clients. “I have a clientele that is remarkable, from every sphere of life,” he has stated. “I could tell you in ten minutes probably 100 famous names who come here.” He continued his practice until he was expelled from the New York State Medical Society in 1975 for malpractice. His book What’s So Bad About Feeling Good? was published in 1983. He passed away in 1987.",
,271,,,,Faulkner,,"Now and then, with a long and fading reverberation, a subway train passes under their feet. Perhaps they think momentarily of two green eyes tunneling violently through the earth without apparent propulsion or guidance, as though of their own unparalleled violence creating, like spaced beads ona string, lighted niches in whose wan and fleeting glare human figureslike corpses set momentarily on end in a violated grave yard leaned in one streaming and rigid direction and flick away.",,
,451,Arts & Letters,10th St & Broadway,"<iframe src=""https://www.google.com/maps/embed?pb=!1m0!3m2!1sen!2sus!4v1447016624488!6m8!1m7!1sHJ2tgj_GFam6Bs51O1qzJA!2m2!1d40.73188652701814!2d-73.99142202374364!3f23!4f0!5f0.7820865974627469"" width=""600"" height=""450"" frameborder=""0"" style=""border:0"" allowfullscreen></iframe>","Federal Writers, Panorama","Whitman rejoiced in Broadway, the “myriadfooted.” In his musically-sensitive imagination, Broadway resounded like an orchestra of complex instruments: “The heavy bass, the great hum and harshness, composite and musical.”
<br><br>
<i>The blab of the pave. . . the tires of carts and<br>
  sluff of bootsoles and talk of the promenaders,<br>
The heavy omnibus, the driver with his<br>
  interrogating thumb, the clank of shod horses<br>
  on granite floor.<br></i>
<br>
His perceptions of Broadway kept changing. Once he described it as an inland sea, with Grace Church at the corner of 10th street
<br><br>
<i>""so adroitly placed that its tall, tapering spire shows down the very center of the busiest three miles of Broadway, like a ghostly lighthouse looming up over the porpoise-backs of the omnibuses, as they lift and dive in that unquiet sea, and over the tossing spray of ribbons and plumes that give back rainbows to the eyes of him that gazes on the living waves.""</i> <a href=""https://www.poets.org/poetsorg/text/walking-tour-walt-whitmans-soho-historic-district-new-york-city"">From Walt Whitman’s SoHo Historic District in New York City</a>","""He who touches the soil of Manhattan and the pavement of New York,” said Lewis Mumford, “touches, whether he knows it or not, Walt Whitman.”",,
,173,,American Museum of Natural History,,"Federal Writers, Panorama",,A Harlem band playing Young Woman’s Blues from a phonograph as the safari breaks camp in Tanganyika under a tile-blue morning sky as intensely lighted as the panorama closed by mountains in the ceiling dome of the African section at the American Museum of Natural History.,,
,287,,,,"Federal Writers, Panorama",,"Popeye, gnarled knight of the clenched fist and the corncob pipe, speaks Tenth Avenue’s indigenous tongue. Betty Boop, epitome of short-skirted innocence in the 1920’s, scolds her little dog and sings her copyrighted ditties in exaggerated New Yorkese....So you say to the waiter, “Gimme the chicken and vegetables but portostat with the chicken with the fustatis on it.” So he says “What?” and you say “You know, the portostat, and moonsign the savina on the top, with the vegetables.”",,
,,New Yorkers,The Plaza Hotel ,"<iframe src=""https://www.google.com/maps/embed?pb=!1m0!3m2!1sen!2sus!4v1447146202477!6m8!1m7!1skrIc0fEU3fAAAAQpj73ZDg!2m2!1d40.7644760636731!2d-73.97279352846067!3f259!4f0!5f0.7820865974627469"" width=""600"" height=""450"" frameborder=""0"" style=""border:0"" allowfullscreen></iframe>",Fitzgerald,,"As I hovered ghost-like in the Plaza Red Room of a Saturday afternoon, or went to lush and liquid garden parties in the East Sixties or tippled with Princetonians in the Biltmore Bar I was haunted always by my other life—my drab room in the Bronx, my square foot of the subway, my fixation upon the day’s letter from Alabama—would it come and what would it say?--my shabby suits, my poverty, and love. While my friends were launching decently into life I had muscled my inadequate bark into midstream.",,
,582,x,Brooklyn Bridge,"<iframe src=""https://www.google.com/maps/embed?pb=!1m0!3m2!1sen!2sus!4v1447024439722!6m8!1m7!1sKx6IUbGVRvZojR7w0K0hrg!2m2!1d40.70735182805521!2d-73.99843683964903!3f232!4f0!5f0.7820865974627469"" width=""600"" height=""450"" frameborder=""0"" style=""border:0"" allowfullscreen></iframe>","Fitzgerald, Gatsby",,"Over the great bridge, with the sunlight through the girders makinga constant flicker upon the moving cars, with the city rising up across the river in white heaps and sugar lumps all built with a wish out of non- olfactory money.",,
,,x,"New York State Pavillion, World’s Fair",,Frei,,"An aerial view in <i>Newsday</i>, dated April 21, shows Warhol’s Ten Most Wanted Men mural at the 1964 World’s Fair covered by a dark tarp.",,
,127,x,Broome & Chrystie Street,,Frisa and Tonchi,,"There’s nothing better than taking a walk through the seedy part of downtown Manhattan during the steamy summer nights. I distinctly remember the smell of cigarettes, alcohol, garbage and cheap perfume.","There’s nothing better than taking a walk through the seedy part of downtown Manhattan during the steamy summer nights. I distinctly remember the smell of cigarettes, alcohol, garbage and cheap perfume. On the way to Keith Haring and Juan Dubose’s cluttered apartment on Broome Street, hookers lined the blocks of Chrystie Street. We always knew that we were near because we could hear the sound of their vinyl hot pants snapping back and forth and their heels clicking.",
,,Scene,101 Ave A ,"<iframe src=""https://www.google.com/maps/embed?pb=!1m0!3m2!1sen!2sus!4v1447154409531!6m8!1m7!1srY7auXcPHvwv9bAaFTpqNg!2m2!1d40.72575838266732!2d-73.98375097855657!3f288!4f0!5f0.7820865974627469"" width=""600"" height=""450"" frameborder=""0"" style=""border:0"" allowfullscreen></iframe>",Frisa and Tornchi,,"The Pyramid on Avenue A was the haven and birthplace of a whole new breed of drag queens: Ethel Eichelberger, Hapi Phace, John Kelly, RuPaul, Lypsinka, Lady Bunny, Taboo!",,
,,Scene,126 East 14th St,"<iframe src=""https://www.google.com/maps/embed?pb=!1m0!3m2!1sen!2sus!4v1447154437538!6m8!1m7!1s5Rund0cNh7gblic7-wwyeQ!2m2!1d40.73363582938288!2d-73.98804285136731!3f205!4f0!5f0.7820865974627469"" width=""600"" height=""450"" frameborder=""0"" style=""border:0"" allowfullscreen></iframe>",Frisa and Tornchi,,"The Palladium: “What I was most interested in was that the discotheque as a building type almost extends beyond the conventional idea of architecture and that even substance is lost in its space. Needless to say, however, its space is naturally built and affected by forms and their material composition as in a usual traditional building, nevertheless, these greatly lose their importance in a disco space, and, instead, momentarily passing lights, sounds and visionary images come to the fore. ","The Palladium: “What I was most interested in was that the discotheque as
a building type almost extends beyond the conventional idea of architecture and that even substance is lost in its space. Needless to say, however, its space is naturally built and affected by forms and their material composition as in a usual traditional building, nevertheless, these greatly lose their importance in a disco space, and, instead, momentarily passing lights, sounds and visionary images come to the fore. Although lighting, video and music are elements of an architectural space, they come to play the main roles in a discotheque. Each of these elements is the material and media of a new type brought forth by the technology of this age. If it is confirmed that space can be transformed by such elements, it will be quite a rare case in the sphere of contemporary architecture where a field of experiment has been lost. Above all, in a discotheque, such technologies pour over the whole body of a person like a shower and stimulate all the senses. It is as if hidden desire is evoked. Rather it would be better to say that a shower of technologies gives birth to successive desires.”",
,,x,1 W 72nd St,"<iframe src=""https://www.google.com/maps/embed?pb=!1m0!3m2!1sen!2sus!4v1447147925674!6m8!1m7!1spvnwu1JDG26pAdSDkMVTUg!2m2!1d40.77642128712903!2d-73.97643623922283!3f25!4f0!5f0.7820865974627469"" width=""600"" height=""450"" frameborder=""0"" style=""border:0"" allowfullscreen></iframe>",Frisa and Tornchi,,"I can’t exactly remember when the world stepped out of the underground and entered the unceasing flux of consensus. It happened, I guess, around 11 o’clock on the evening of December 8, 1980, uptown New York, on the sidewalk in front of the Dakota building. David Mark Chapman, twenty-five years old, from Hawaii, popped out from the underground of his mind and fired five shots at John Lennon. When Lennon died at St. Luke’s-Roosevelt Hospital Center, the underground ended and the eighties began. The seventies were the subsoil of our culture, maybe not really the sub-soil but only a sad basement, one of those with windows at sidewalk level, from where you can see people’s ankles passing by. The ankle is that part of the body that more than any other reveals how unsexy the seventies were. From the basement the world was seeking out for some form of deliverance. From their ankles the seventies wanted to climb up as far as to the shoulders.<br>Honestly the true underground was finished by the end of the sixties, with the livid turmoil of the 68 movement making mincemeat of it. The seventies, by contrast, were a pimple on the face of Western society. The underground was the smell of cigarette smoke, unmade beds, bodies naked, not bundled up, dark glasses even at night, spend not thrift, personal not collective risk, vulgarity not malaise, personality not insecurity. The bullets that smacked into John Lennon’s body arrived from the seventies’ awkwardness, shattering what was left over from the sixties. Those bullets made a breach in the sewers of the Western world’s underground, from which it poured out the excessive effluvium of a decade in which success and excess swapped places continually, softening even the hardest dwellers of sewers, cellars and miserable basements.<br><br>...Those who died as losers died twice over in the society of the eighties.",,
,,W-Cinematic New York,,,Fritscher,,"Susan Strasberg once said that she and her friend Marilyn Monroe were walking down Fifth Avenue and no one noticed them. <br>
Marilyn, who was studying at Lee Strasberg’s Actor’s Studio, said to Susan, “Do you want them to see me do her?”<br>
The private Norma Jean, standing on the street, adjusted her posture, her walk, and her face. 
Suddenly she was mobbed.<br>",,
,,W-Cinematic New York,,,Fritscher,,"Mapplethorpe codged drugs, sex, leather, superstars, and ideas from the underground movies of Warhol and Anger.",,
,,x,,,Fritscher,re: Patti Smith and Mapplethorpe,"Literally, as well as metaphorically, pop culture success depends on who fucks whom.",,
,714,City on Fire,The Lincoln Center,,"Garbage Guerrilla: The Mystery Man Behind the East Village Art Gang with the Unprintable Name by John McMillan, 2007","The Up Against the Wall Motherfuckers (often referred to as simply ""The Motherfuckers"", or UAW/MF) was an anarchist affinity group based in New York City. This ""street gang with analysis"" was famous for its Lower East Side direct action and is said to have inspired members of the Weather Underground and the Yippies. "," “In the West Coast, there were flower children. In the East Coast, there were weed children. They just grew out of the sidewalk.”","In 1967, during a New York City garbage strike, they carried piles of stinking, festering trash uptown on the subway and dumped it on the steps and in the fountain of Lincoln Center. “WE PROPOSE A CULTURAL EXCHANGE,” they declared in an accompanying leaflet: “garbage for garbage.” ... “They lived like gutter rats,” Abbie Hoffman once recalled. Journalist Thai Jones ... quipped that although the Motherfuckers “referred to themselves as ‘a street gang with analysis’ ... they seemed to emphasize the street gang part.” Yippie Stewart Albert ... put the difference between the Diggers and the Motherfuckers this way: “In the West Coast, there were flower children. In the East Coast, there were weed children. They just grew out of the sidewalk.”",
,,x,Broad St & Wall St,"<iframe src=""https://www.google.com/maps/embed?pb=!1m0!3m2!1sen!2sus!4v1447148107763!6m8!1m7!1sEsH04N_Pa0lJ6ZaIeMCwOg!2m2!1d40.70812003126338!2d-74.01143543080353!3f307!4f0!5f0.7820865974627469"" width=""600"" height=""450"" frameborder=""0"" style=""border:0"" allowfullscreen></iframe>",Garnick,,"Broad St., near Wall St. began as a brook. The Dutch, homesick for Holland, widened it into a canal with a roadway and it became the City’s first “common seuer.”",,
,,Ghost Town,206 E 7th St ,"<iframe src=""https://www.google.com/maps/embed?pb=!1m0!3m2!1sen!2sus!4v1447024818994!6m8!1m7!1s6Rb_R3ZTKHHOjOEWz0WrwQ!2m2!1d40.72457020501854!2d-73.98005843375249!3f196!4f0!5f0.7820865974627469"" width=""600"" height=""450"" frameborder=""0"" style=""border:0"" allowfullscreen></iframe>",Ginsberg,"Ginsberg lived with William Burroughs in the East Village the year he wrote ""Howl.""",Moloch! Moloch! Robot apartments! invisible suburbs! skeleton treasuries! blind capitals! demonic industries! spectral nations! invincible madhouses!,,
,251,Under the Influence,Battery,"<iframe src=""https://www.google.com/maps/embed?pb=!1m0!3m2!1sen!2sus!4v1446834833591!6m8!1m7!1s0vC5lUL-8Zvflc7e_M2IdA!2m2!1d40.7033231!2d-74.0144554!3f266.8383736792325!4f-6.302737765111701!5f0.7820865974627469"" width=""600"" height=""450"" frameborder=""0"" style=""border:0"" allowfullscreen></iframe>","Ginsberg, <i>Howl</i>",,who chained themselves to subways for the endless ride from Battery to holy Bronx on Benzedrine,,
,,New Yorkers,405 E 10th St,"<iframe src=""https://www.google.com/maps/embed?pb=!1m0!3m2!1sen!2sus!4v1447153917934!6m8!1m7!1s8mV35oRDJxCyQtcVcUkFlA!2m2!1d40.72564051357842!2d-73.97706131386502!3f222.49921160292658!4f-6.326889685997344!5f0.7820865974627469"" width=""600"" height=""450"" frameborder=""0"" style=""border:0"" allowfullscreen></iframe>","Ginsberg, Collected",Ginsberg lived on 10th st from 1965-1975,"Tonite I walked out of my red apartment door on East Tenth Street’s<br> dusk—<br>Walked out of my home ten years, walked out in my honking<br> neighborhood<br>Tonite at seven walked out past garbage cans chained to concrete<br> anchors<br>Walked under black painted fire escapes, giant castiron plate<br> covering a hole in ground<br>—Crossed the street, traffic lite red, thirteen bus roaring by liquor <br>store,<br>part corner pharmacy iron grated, past Coca Cola & Mylai posters<br> fading scraped on brick<br>Past Chinese Laundry wood door’d, & broken cement stoop steps <br>For Rent hall painted green & purple Puerto Rican style<br>Along E. 10th’s glass spattered pavement, kid blacks & Spanish oiled<br> hair adolescents’ crowded house fronts—<br>Ah, tonite I walked out on my block NY City under humid summer<br> sky Halloween",,
,,The Biz,26 St & Madison Ave,,"Ginsberg, Howl","""Madison Avenue"" stands for the cluster of advertising agencies...etc. ","who were burned alive in their innocent flannel suits<br> on Madison Avenue amid blasts of leaden verse<br>& the tanked-up clatter of the iron regiments<br>of fashion & the nitroglycerine shrieks<br>of the fairies of advertising & the mustard gas of sinister intelligent editors, or were run down by the<br> drunken taxicabs of Absolute Reality",,
,283,x,,,Glanz and Lipton,,"On the radio district which was replaced by the World Trade Center: And what an area it was, especially in its sounds. A walk down the streets presented a constantly shifting cacophony, as most of the shop owners had mounted big cone-shaped vibrating speakers over their doorways, blasting out everything from the teariest opera to big-band orchestral music to step-right-up sales pitches that ran over and over. Piercing through all that noise was the a-ooga of car horns on the street, the whistle of the ferries that docked in the slips right at the foot of Cortlandt Street, and the much deeper bellow from the tugboats plying the river. There was the occasional clop of horses—in the late 1920s there were still a few horse-drawn drays moving small loads of cargo or scrapwood, and they could be seen negotiating the widest of U-turns at the Cortlandt intersections.",,
,,x,,,Goldenberg,,"Lee Harvey Oswald lived in New York—first on East 92 Street in Manhattan, later on Sheridan Avenue and then East 179th Street in the Bronx—from August 1952 to January 1954, leaving for New Orleans almost a decade before the Kennedy assassination.",,
,,x,Bronx Zoo,"<iframe src=""https://www.google.com/maps/embed?pb=!1m0!3m2!1sen!2sus!4v1447107975505!6m8!1m7!1sbfuMDI8n6fxLv4atzF9rUg!2m2!1d40.84611250009517!2d-73.88028327341128!3f57.47225303516168!4f23.752233096629865!5f0.7820865974627469"" width=""600"" height=""450"" frameborder=""0"" style=""border:0"" allowfullscreen></iframe>",Goldenberg,,"For two miserable, tumultuous weeks in 1906, Ota Benga, a 23-year-old pygmy from the Belgian Congo, was put on display at what was then called the New York Zoological Society in the Bronx. The public, appalled and entertained in equal measure, flocked to the primate house, where Benga could be observed playing with Dahong, the zoo’s orangutan, beneath a sign that read in part, “Height 4 feet 11 inches. Weight 103 pounds. Exhibited each afternoon during September.”",,
,87,Scene,101 W 18th St,"<iframe src=""https://www.google.com/maps/embed?pb=!1m0!3m2!1sen!2sus!4v1447154657182!6m8!1m7!1si5KD1vn8YAm8OIFed-uUvw!2m2!1d40.73973845368837!2d-73.99475226933282!3f275!4f0!5f0.7820865974627469"" width=""600"" height=""450"" frameborder=""0"" style=""border:0"" allowfullscreen></iframe>",Goldsmith,,"Shortly before he died, we were invited to dinner at Merce Cunningham’s loft on Sixth Avenue. Upon entering, we were astonished to see numerous priceless works of art lining the walls. ","Shortly before he died, we were invited to dinner at Merce Cunningham’s loft on Sixth Avenue. Upon entering, we were astonished to see numerous priceless works of art lining the walls. When we inquired “Is that ... ?” we were unceremoniously cut off and told that everything here is what you think it is. There were Johnses, Rauschenbergs and even a little Duchamp <i>Tzank Check</i> framed in a ’70s plexiglass frame close the floor, covered in cooking grease, dust and cat piss. Over many valuable works of art were leaky skylights. During dinner we asked Merce what would happen if one of these works were damaged. He smiled and said, “But of course our friends would just make us another.”
",
,,x,,,"Goldsmith, Theory",,Ted Berrigan stole books by famous authors and forged their autographs from Fourth Avenue bookshops. He then sold them back to the dealers he stole them from at greatly increased prices. ,,
,,Scene,81 University Pl,"<iframe src=""https://www.google.com/maps/embed?pb=!1m0!3m2!1sen!2sus!4v1447154468615!6m8!1m7!1sWun9up5-FvupWtqx_1YUyw!2m2!1d40.7334877939732!2d-73.99316701148312!3f283!4f0!5f0.7820865974627469"" width=""600"" height=""450"" frameborder=""0"" style=""border:0"" allowfullscreen></iframe>",Gooch,Cedar Tavern,"Regulars at the Cedar Tavern: David Smith, Philip Guston, Mark Rothko, Isamu Noguchi, Barnett Newman, Norman Bluhm, Howard Kanovitz, Aristodemis Kaldis, Michael Goldberg, Herman Cherry, Jack Tworkov,John Cage, Edwin Denby, John Gruen, Morton Feldman, Harold Rosenberg, Clement Greenberg, Alfred Leslie, Arnold Weinstein, Robert Rauschenberg, Jasper Johns, Irving Sandier, and Milton Resnick; among the few womenin the classic “men’s bar” were Helen Frankenthaler, Grace Hartigan, Joan Mitchell, Jane Wilson, Barbara Guest, Elaine Mercedes Matter, and Ruth Kligman.",,
,,The Biz,E 55th St & Madison Ave,"<iframe src=""https://www.google.com/maps/embed?pb=!1m0!3m2!1sen!2sus!4v1447155040306!6m8!1m7!1s2XSWqhi_SKYsgkdVM9VyNQ!2m2!1d40.7609916!2d-73.9733124!3f225!4f0!5f0.7820865974627469"" width=""600"" height=""450"" frameborder=""0"" style=""border:0"" allowfullscreen></iframe>",Gooch,Hugo Gallery = E 55th St & Madison Ave,"O’Hara was vexed by Warhol’s rise. They had both arrived in New York at about the same time. But Warhol’s acceptance by the art world in which O’Hara was so celebrated was peripheral at best. Of Warhol’s first show at the Hugo Gallery in 1952, an unimpressed Art News reviewer had written that his drawings of young boys’ heads and women dressed in the style of the twenties were “airily” reminiscent of the novels of Truman Capote. ",,
,,x,,,Gooch,,"Warhol had filmed Freddy Herko, a  struggling dancer roller-skating all over New York on one bleeding foot in a sixteen-millimeter film titled <i>Dance Movie</i> in September 1963. In October 1964, Herko killed himself tripping on LSD by dancing out the fifth-floor window of a friend’s Greenwich Village apartment while Mozart’s <i>Coronation Mass</i> played on the record player. When he heard the news, Warhol reportedly said, “Why didn’t he tell me he was going to do it? We could have gone down there and filmed it!”",,
,,x,,,Gooch,,"On the evening of September 7, 1964, Frank O’Hara held a small party to watch the arrival of the Beatles at Kennedy Airport where they were met by a screaming crowd of ten thousand. ",,
,,,8th st & Lexington,,Gooch,,"As a curator, O’Hara had visited Warhol’s studio in 1959. “He was very unkind to Andy,” says the poet John Giorno. “This was when Andy was still drawing shoe ads and making all that money. Frank O’Hara and two other people came to visit Andy in that house on Eighty-ninth Street and Lexington Avenue. It was very chicly decorated at the time—black vinyl walls, a horse from a carousel. I remember Andy saying that Frank walked into that front room and just started laughing and putting him down for being chi-chi. That’s not what they wanted to see or what they thought was important. He told me, ‘Frank was so meeeean.’ That carried through when he became a famous artist. But then at some point Frank made a change and thought that what Andy was doing was valid.”",,
,168,Landmarks,Solomon R. Guggenheim Museum,"<iframe src=""https://www.google.com/maps/embed?pb=!1m0!3m2!1sen!2sus!4v1447024313360!6m8!1m7!1s1k-97t9vD_aFySTF3FAR_w!2m2!1d40.78311216583699!2d-73.95925382945138!3f122!4f0!5f0.7820865974627469"" width=""600"" height=""450"" frameborder=""0"" style=""border:0"" allowfullscreen></iframe>",Gopnick,"Designed by Frank Lloyd Wright, the Guggenheim's cylindrical building, wider at the top than the bottom, was conceived as a ""temple of the spirit"". ","In New York, even monuments can fade from your mental map under the stress of daily life. I can walk to the Guggenheim if I want to, these days, but in my mind it has become simply a place to go when the coffee shops are too full. Another day, suddenly turning a corner, I discover the old monument looking just as it did the first time I saw it, the amazing white ziggurat on a city block, worth going to see.",,
