Rank,Page,Tour,Location,Streetview Embed Code,Source,Context,Preview,Quote,
,449,New Yorkers,222 Bowery,"<iframe src=""https://www.google.com/maps/embed?pb=!1m0!3m2!1sen!2sus!4v1447015893705!6m8!1m7!1ssstm2M9ZCupP7EW9Q_4vPQ!2m2!1d40.72204244004339!2d-73.99345588585362!3f288!4f0!5f0.7820865974627469"" width=""600"" height=""450"" frameborder=""0"" style=""border:0"" allowfullscreen></iframe>","<i>Warhol</i> by Victor Bockris, 1997","Burroughs' apartment on the Bowery was a ""large three-room apartment which used to be the locker room of a gymnasium. He call[ed] it the Bunker."" Bockris, author of <i>Burroughs</i> writes, ""Going to the Bunker can be a hazardous experience, and in fact William personifies more than any other man I have ever met a person aware of the hazards surrounding him. He has recently equipped me with a cane, a tube of tear gas, and a blackjack. 'I would never go out of the house without all three on me,' he says pointedly.""","On an average day in New York, William S. Burroughs gets up between 9:00 and 10:00 and shaves. In a dream note made on 13th August 1975 he wrote: “Things needed. Shaving mirror. Anyone used to shave feels deteriorationif he cannot.” From Retreat Diaries. Burroughs associates shaving with civilization and throughout his travels has never grown a beard or mustache.","On an average day in New York, William S. Burroughs gets up between 9:00 and 10:00 and shaves. In a dream note made on 13th August 1975 he wrote: “Things needed. Shaving mirror. Anyone used to shave feels deteriorationif he cannot.” From Retreat Diaries. Burroughs associates shaving with civilization and throughout his travels has never grown a beard or mustache.<br><br>Then he takes a 100 milligram capsule of vitamin B1 because he believes it replaces the B1 that alcohol removes from the system. He dresses, washes last night’s dishes, and eats breakfast. He likes coffee with a donut, English muffin, or angel food cake.<br><br>Around 11:00 he goes down four long flights of stairs to get his mail (5-10 pieces daily). Between 11:30 and 12:30 he putters around the loft looking at notes, writing notes, and checking through various books.<br><br>Between 12:30 and 1:00 Bill often goes out shopping for groceries or, lately, new clothes. He’s usually back by 1:00, eats no lunch and writes between 1:00 and 4:00 in the afternoon.<br><br>If James Grauerholz is working with him on a manuscript or a reading, James will arrive around 4:00 in the afternoon and will stay through dinner. This happens, on the average, three times a week. They go over the work between 4:00 and 6:00 when Burroughs often relaxes, sitting in a rocking chair by the window. “It’s a very beautiful sight,” James says. “I’ll be working at the other end of the loft. I’ll look up, and there will be William just sitting perfectly still in his chair looking kind of serene.”<br><br>At 6:00 P.M. Burroughs pours himself a drink. Dinner is between 7:30 and 8:30.<br><br>All his life Burroughs has eaten in restaurants. Today, he shops and cooks for himself, often having friends over, or going to their places nearby for dinner. After dinner, conversation continues until 11:00 or 12:00 and then usually home or to bed. Occasionally he stays up talking till dawn.<br><br>An average Burroughs day produces six pages. Sometimes he’ll write as many as fifteen. When he started <i>Cities of the Red Night</i> he produced 120 pages in two weeks. “William’s very good at knowing when to leave things alone and when to go back to them. He knows when enough is enough,” James reports. “Sometimes I may try to push him on something—looking at a manuscript when 600 pages have been written and saying, ‘We should begin editing that’—and he’ll say, ‘No ... that’ll take another couple of years.’ He’s seen enough time pass that he knows how to pace himself.”",
1,,The Biz,New York University,"<iframe src=""https://www.google.com/maps/embed?pb=!1m0!3m2!1sen!2sus!4v1447154739895!6m8!1m7!1sG7Vm6WWZZGGOuXiuErBXXQ!2m2!1d40.72936655935794!2d-73.9961699341338!3f90!4f0!5f0.7820865974627469"" width=""600"" height=""450"" frameborder=""0"" style=""border:0"" allowfullscreen></iframe>","<i>Warhol</i> by Victor Bockris, 1997","Edward Bernays was the first professor in the field of public relations and propaganda, which he taught at NYU. He's referred to in his obituary as ""the father of public relations"" for combining the ideas of Gustave Le Bon and Wilfred Trotter on crowd psychology with the psychoanalytical ideas of his uncle, Sigmund Freud.","Publicity had not been an issue with artists in the Forties and Fifties. It might come as a bolt from the philistine blue, as when Life made Jackson Pollock famous; but such events were rare enough to be freakish, not merely unusual. By today’s standards, the art world was virginally naive about the mass media and what they could do. Television and the press, in return, were indifferent to what could still be called the avant-garde. “Publicity” meant a notice in the <i>New York Times</i>, a paragraph or two long, followed eventually by an articlein <i>Art News</i> which perhaps five thousand people would read. Anything else was regarded as extrinsic to the work—something to view with suspicion, at best an accident, at worst a gratuitous distraction. One might woo a critic, but not a fashion correspondent, a TV producer, or the editor of <i>Vogue</i>. To be one’s own PR outfit was, in the eyes of the New York artists of the Forties or Fifties, nearly unthinkable—hence the contempt they felt for Salvador Dalí.",,
,,x,Broadway & Franklin,,"<i>Warhol</i> by Victor Bockris, 1997",,"t’s a rainy Thursday evening when I step out of a cab at the corner of Broadway and Franklin streets in lower Manhattan on my way to dinner with William Burroughs.<br>I gaze down a line of warehouses with a haphazard mixture of small trucks and old cars parked in front of them, spot Burroughs’s four story building, hurry diagonally across the street, push open the door and step into the foyer. The hall light is out and I feel cautiously for the banisters as two bottles of cold white wine clink in the crook of my arm. Warped wooden stairs lead to the top floor past a series of wall paintings.<br>The loft is impeccably clean. The old wooden floors beam with polish, the bed is neatly made, all surfaces are devoid of other than essentials ... I notice an efficient-looking brand new kitchen has been installed. The loft feels warm and lived in whilst remaining concisely organized.",,
,245,Under the Influence ,Rikers Island,"<iframe src=""https://www.google.com/maps/embed?pb=!1m0!3m2!1sen!2sus!4v1446832337227!6m8!1m7!1sHyVmUikjm2VVW4ahz6Ay_g!2m2!1d40.77379019803261!2d-73.8929249443051!3f23.4284119568171!4f-14.020113701670496!5f0.7820865974627469"" width=""600"" height=""450"" frameborder=""0"" style=""border:0"" allowfullscreen></iframe>","<i>With William Burroughs: A Report from the Bunker</i> by Victor Bockris, 1981",,"""Burroughs: “Heroin was $28 an ounce in the 1920s. Actually there was more morphine on the street rather than heroin. In the 1920s they brought in morphine. Then heroin came in in the late 1920s. Heroin is now about $9,000 an ounce","""Burroughs: “Heroin was $28 an ounce in the 1920s. Actually there was more morphine on the street rather than heroin. In the 1920s they brought in morphine. Then heroin came in in the late 1920s. Heroin is now about $9,000 an ounce, so imagine from $28 an ounce to $9,000 and junk turns out to be a model for inflation, being the most inflated item. A friend of mine … who did time on Rikers Island in the thirties, told me the guards came in every morning with a shoebox full of heroin decks at fifty cents a deck. On one deck you could stay loaded all day and do the time standing on your head. With junk you are immune to boredom and discomfort … Now there’s good heroin on the street again and you can maintain a habit for $12 a day.”""",
,282,,,,Boogie Down Productions,,"It was ’76 to 1980<br>The dreads in Brooklyn was crazy<br>You couldn’t bring out your set with no hip-hop<br> Because the pistols would go POP",,
,266,x,,,Botkin,,In a high wind tenants sometimes hear ghost “typewriters” tapping away like mad in empty offices—but this is only the building’s steel skeleton creaking and groaning.,,
,,Animal New York,East Harlem - El Barrio,"<iframe src=""https://www.google.com/maps/embed?pb=!1m0!3m2!1sen!2sus!4v1447130060011!6m8!1m7!1suySVL6Xz_DL-S0iqKnh_FQ!2m2!1d40.79898726496715!2d-73.93323283684981!3f31.023632824154564!4f8.647813304144492!5f0.7820865974627469"" width=""600"" height=""450"" frameborder=""0"" style=""border:0"" allowfullscreen></iframe>","<i>In Search of Respect: Selling Crack in El Barrio</i> by Philippe Bourgois, 2002","Phillippe Bourgois spent four years living with a group of Puerto Rican crack dealers in East Harlem, taping hundreds of hours of conversation. In this scene, one of the principle subjects, Caesar traces ""the full ambigious cycle"" where ""both the criminals and the police play by the rules of the culture of terror."" ",I don’t even know why they have human police officers. They should just put animals out there patrolling the streets. Word up! Cause they’re worse than animals. It’s like they’re animals with a mind. ,,
,,,441 E 9th St ,,Brainard,FOH lived at 441 E 9th St from 1959-1963,I remember the first time I met Frank O’Hara. He was walking down Second Avenue. It was a cool early Spring evening but he was wearing only a white shirt with the sleeves rolled up to his elbows. And blue jeans. And moccasins. I remember that he seemed very sissy to me. Very theatrical. Decadent. I remember that I liked him instantly. ,,
,47,Animal New York,Natural History Museum,"<iframe src=""https://www.google.com/maps/embed?pb=!1m0!3m2!1sen!2sus!4v1447023828038!6m8!1m7!1sWtXtWFYiNcwZYLv1Q98gJQ!2m2!1d40.7807496!2d-73.9726489!3f0!4f0!5f0.7820865974627469"" width=""600"" height=""450"" frameborder=""0"" style=""border:0"" allowfullscreen></iframe>","<i>With William Burroughs: A Report from the Bunker</i> by Victor Bockris, 1981","New York City hosts more roach diversity than any known place. There are an estimated 10,000 distinct species worldwide. ","BOCKRIS: Up at the Natural History Museum there is a woman studying the international roach population, spending nights with them, and doing very close-up portraits of them. She obviously knows what’s going on, whatever it is. ","BOCKRIS: Up at the Natural History Museum there is a woman studying the international roach population, spending nights with them, and doing very close-up portraits of them. She obviously knows what’s going on, whatever it is. These roaches are widespread and venomously effective.<br><br>
BURROUGHS: Widespread they are, yes.<br><br>
BOCKRIS: They’re brave and aggressive creatures, because what chance do they stand against you when they come out?<br><br>
O’BRIEN: Some of them are smart, some of them learn to jump at the right time.<br><br>
BURROUGHS: Some of them have wings.<br><br>
BOCKRIS: You stated flatly that all waterbugs had wings.<br><br>
BURROUGHS: As far as I know, although they may undergo various cycles.<br><br> O’BRIEN: They eat plastic.<br><br>
BURROUGHS: Yes. They eat glue, they eat the bindings out of your books.<br><br> BOCKRIS: We’re closer to roaches than almost anything else in New York and we don’t know anything about them, their habits.<br><br>
BURROUGHS: I think you’re a bleeding heart do-gooder; you think we should get to know more about roaches. I doubt it, frankly.",
,21,x,TBD,,Brooks,,In 1930 a journalist comparing the transit systems of the world concluded that New York’s subways were more an expression of itself than any in Europe.,"In 1930 a journalist comparing the transit systems of the world concluded that New York’s subways were more an expression of itself than any in Europe. “In no European city,” he said, “would the subway be chosen as a symbol of urban life.” The subway represents New York City as surely as the freeway represents Los Angeles.",
,118,x,,,Brown,,Art Street was the former name of Astor Place. Originally it was a lane leading from the Bowery to a part of the Stuyvesant Farm. It was known as Art St. in 1807.,,
,118,,,,Brown,,Abattoir Place was the former name of West 12th St. between 11th Ave. and the Hudson River.,,
,118,,,,Brown,,Jew’s Alley was the former name of South William St. between Broad Street and Mill Lane. Jew’s Alley formerly ran from Madison St. between Oliver and James Sts.,,
,,x,,,Brox,,"In 1973, Richard Nixon called for the dimming of nonessential lighting such as advertisements and all decorative Christmas lights, both public and private, including the lights in New York City’s Times Square. “It’s very sad to be a party to darkening a city so renowned for its lights—it’s just heartbreaking,” the municipal service administrator for New York City commented. “But it has a psychological effect, because it’s difficult to get someone to turn down his thermostat if he sees lights blazing in a public space.”",,
,,x,,,"Brox, Jane. Brilliant: The Evolution of Artificial Light. Boston: Houghton Mifflin Harcourt, 2010.",blackout,"Night was truly night again, just as in the Middle Ages, and, also as in the Middle Ages, light became precious once more. People struck match after match to light their way down flights of stairs: two matches, carefully tended, we’re enough to light the distance between one floor and the next. “Walking down 18 flights to the lobby, we used exactly 36 matches.”...The moonlight lay on the streets like thick snow, and we had a curious, persistent feeling that we were leaving footprints in it. Something was odd about buildings and corners in this beautiful light. The city presented a tilted aspect, and even our fellow pedestrians, chattering with implacable cheerfulness, appeared foreshortened as they passed; they made us think of people running downhill. It was a block more before we understood: The shadows, for once, all fell in the same direction—away from the easterly, all- illuminating moon ... We were in a night forest, and, for a change, home lay not merely uptown but north.",,
,696,City on Fire,Wall and broad St,,"<i>Buda's Wagon: A Brief History of the Car Bomb</i> by Mike Davis, 2007","Mario Buda identified with Luigi Galleani 's idea of ""propaganda of the deed,"" a strain of Anarchist thought that believed that specific political action meant to be exemplary to others. From 1914 to 1932, Galleani's followers in the United States carried out a series of bombings and assassination attempts against institutions and persons they viewed as class enemies.","You have shown no pity to us! We will do likewise. We will dynamite you!— Anarchist warning, 1919.","On a warm September day in 1920, a few months after the arrest of his comrades Nicola Sacco and Bartolomeo Vanzetti (“the best friends I have in America”), a vengeful Italian immigrant anarchist named Mario Buda parked his horse-drawn wagon near the corner of Wall and Broad streets, next to the new federal Assay Office and directly across from J. P. Morgan and Company. The Morgan partners, including the great Thomas Lamont and Dwight Morrow (Charles Lindbergh’s future father-in-law), were discussing weighty financial matters in a lower-floor conference room. Perhaps Buda tipped his cap in the direction of the unsuspecting robber barons before he nonchalantly climbed down and disappeared unnoticed into the lunchtime crowd. A few blocks away, a startled letter-carrier found strange, crudely printed leaflets warning: “Free the Political Prisoners or it Will Be Sure Death for All of You!” They were signed: “American Anarchist Fighters.”<br>
Buda, aka “Mike Boda,” was a veteran supporter of Luigi Galleani, anarchist theorist and editor of Cronaca Sovversiva (“Subversive Chronicle”), which the Department of Justice in 1918 had condemned as “the most dangerous newspaper in this country.” The Galleanisti (probably never more than 50 or 60 hardcore activists) were chief suspects in various dynamite plots, including the notorious Preparedness Day bombing in San Francisco in 1916 (for which union organizers Tom Mooney and Warren Billings were framed) and the letter bombs sent to prominent members of the Wilson administration as well as J. P. Morgan and John D. Rockefeller in June 1919. The Cronaca Sovversiva reading circles that met in the shadows of Paterson silk factories and Youngstown steel mills—not unlike certain contemporary Quran study groups in gritty neighborhoods of Brooklyn and south London—were lightning rods for immigrant alienation; an alienation that grew into rage in the face of wartime anti-foreign hysteria, which resulted
in the so-called Palmer Raids in 1919 against radicals of all denominations. When Attorney General A. Mitchell Palmer signed Galleani’s deportation order in February 1919, anonymous flyers appeared in New England factories promising to “annihilate” the deporters “in blood and fire.”<br>
As Buda, who had appointed himself the avenging angel of the imprisoned and deported anarchists, made his escape from Wall Street, the bells of nearby Trinity Church began to toll noon. Before they had stopped, the wagon packed with high explosive (probably blasting gelatin stolen from a tunnel construction site) and iron slugs erupted in a huge ball of fire, leaving a large crater in Wall Street. Windows exploded in the faces of office workers, pedestrians were mowed down by metal shrapnel or scythed by shards of glass, building awnings and parked cars caught fire, and a suffocating cloud of smoke and debris enshrouded Wall Street. Skyscrapers quickly emptied. Panicked crowds fled past crumpled bodies on the sidewalks, some of them writhing in agony. On the treeless street, green leaves bearing presidents’ portraits—some of the estimated $80,000 in cash abandoned by terrified or wounded bank messengers—fluttered with each choking gust of wind and ash. No one knew whether more explosions would follow, and frightened authorities suspended trading at the Stock Exchange for the first time in history.<br>
An attack on Wall Street, of course, was immediately construed as
a national emergency. One hundred regular soldiers, rifles loaded and bayonets fixed, were sent quickly from Governor’s Island to guard the badly damaged Assay Office and adjacent Subtreasury, while America’s chief sleuth, William Flynn, the head of the (federal) Bureau of Investigation, was dispatched from Washington on the first available train. Over the next few days, the NYPD’s Detective Bureau assembled the grotesque remains of
an “infernal machine”: a horse’s head, some severed hoofs, and the twisted metal of a wagon axle. Anarchists, the IWW, and the new-fangled Bolsheviki all automatically became suspect and the New York Times soon screamed “Red Plot Seen in Blast.” While police and federal investigators focused on “celebrity” Reds such as labor-organizer Carlo Tresca, Buda quietly made his way home to Italy. (It is unknown whether other Galleanisti participated in the organization of the bombing or whether Buda was an astonishing one- man show.)<br>
Meanwhile, the coroner was counting 40 dead (some mangled beyond recognition), with more than 200 injured, including Equitable Trust’s president Alvin Krech and J. P. Morgan Jr’s son Junius. Joseph P. Kennedy, walking in the street, was badly shaken but unharmed. Buda was undoubtedly disappointed when he learned that “Jack” Morgan himself was away in Scotland at his hunting lodge, and that his partners Lamont and Morrow were unscathed. Nonetheless, a poor immigrant with some stolen dynamite, a pile of scrap metal, and an old horse had managed to bring unprecedented terror to the inner sanctum of American capitalism.",
,280,,,,John Cage about Silence.” YouTube,,"When I hear what we call music, it seems to me that someone is talking. And talking about his feelings or about his ideas, of relationships. But when I hear traffic, the sound of traffic here on Sixth Avenue for instance, I don’t have the feeling that anyone is talking, I have the feeling that a sound is acting, andI love the activity of sound. What it does, is it gets louder and quieter, and it gets higher and lower. And it gets longer and shorter. I’m completely satisfied with that, I don’t need sound to talk to me. And this silence, almost anywhere in the world today, is traffic. If you listen to Beethoven, it’s always the same, but if you listen to traffic, it’s always different.",,
,189,Animal New York,Metropolitan Opera House,"<iframe src=""https://goo.gl/maps/LuFVqE8uA2U2"" width=""600"" height=""450"" frameborder=""0"" style=""border:0"" allowfullscreen></iframe>","<i>New York Night: The Mystique and its History</i> by Mark Caldwell, 2005",An Irish Terrior named Masterpiece won the show. ,1899: A dog show held in the Metropolitan Opera House a few weeks prior to its opening left a major infestation of fleas in the auditorium’s plush seats.,,
,418,Ghost Town,302 West 11th St,"<iframe src=""https://www.google.com/maps/embed?pb=!1m0!3m2!1sen!2sus!4v1447021271854!6m8!1m7!1sZYPWH-RETfpHidjsvEpD6Q!2m2!1d40.73582577635537!2d-74.00610519607727!3f198!4f0!5f0.7820865974627469"" width=""600"" height=""450"" frameborder=""0"" style=""border:0"" allowfullscreen></iframe>","<i>New York Night: The Mystique and its History</i> by Mark Caldwell, 2005","The poet Dylan Thomas died in New York's White Horse Tavern. His famous last words: ""I've had 18 straight whiskies......I think that's the record.""  He was 39 years old. ","In recollections of the 1950s, in films, and in photographs, perhaps the most striking feature of Manhattan that emerges again and again is its emptiness—the abandoned look of even its most important arteries. Third and Sixth Avenues had the excuse of sudden exposure after decades under the shadow, soot, and screech of their elevated lines.","In recollections of the 1950s, in films, and in photographs, perhaps the most striking feature of Manhattan that emerges again and again is its emptiness—the abandoned look of even its most important arteries. Third and Sixth Avenues had the excuse of sudden exposure after decades under the shadow, soot, and screech of their elevated lines. But much of the rest of New York looked similar—beaten up and exhausted by hard use.<br><br>This comes out most poignantly in photographic records of Greenwich Village. The streets are void of traffic, both vehicular and pedestrian: parking spaces abound; the signs are handmade and amateurish. Café and restaurant interiors resemble grammar school classrooms, a clutter of junk and a creativity more childish than avant-garde. Exteriors seem forgotten, embalmed: in a 1960 photo of the White Horse Tavern on Hudson Street, now a sidewalk café overrun by models and stockbrokers, looks like what it then really was: a seedy bar on the corner of fire escapes and walkup apartments.",
,574,Politics,Madison Square Garden,"<iframe src=""https://www.google.com/maps/embed?pb=!1m0!3m2!1sen!2sus!4v1447154112064!6m8!1m7!1soNLUY0e1h3TArhVA5rqikw!2m2!1d40.75083988515463!2d-73.99443404242773!3f93!4f0!5f0.7820865974627469"" width=""600"" height=""450"" frameborder=""0"" style=""border:0"" allowfullscreen></iframe>","<i>New York Night: The Mystique and its History</i> by Mark Caldwell, 2005",,"The <i>Herald</i> announces: “Residents of New York City and the country around will be able to read in the skies the result of the battle of the ballots to-morrow.” A searchlight, placed atop the Madison Square Garden Tower, beamed out the results as soon as they came in, pointing southward to announce that the Democrats had won.",,
,28,x,,,"<i>New York Night: The Mystique and its History</i> by Mark Caldwell, 2005",,"By day New York turns to practicality, to the provident tasks of survival. But at night ancient Manhattan comes back as a ghost from a deeper world still living but unwisely forgotten.",,
,,,5th Ave and Madison Square,,"<i>New York Night: The Mystique and its History</i> by Mark Caldwell, 2005",,"A five-story-high plaster and wood arch over Fifth Avenue at Madison Square, built to commemorate the Spanish-American War, featured a garland of electric lights. But it looked stodgy beside a 45-foot-long Heinz pickle blaring out across the square, outlined in rapidly blinking green bulbs with 577 GOOD THINGS FOR THE TABLE flashing beneath it in a riot of color.",,
